{
  "relisId": "PRO-TAL-GEN-006",
  "name": "Repos discipliné",
  "type": "talent",
  "tags": ["progression", "talent", "general"],
  "system": {
    "description": "<p>Après un repos long complet et sûr, le personnage retire 2 Stress supplémentaires.</p>\n<p>Si son Stress est déjà à 0, le bénéfice n&#39;est pas conservé. Le talent ne rend pas un repos dangereux ou incomplet automatiquement sûr et ne retire aucun Traumatisme.</p>",
    "traits": ["Général", "Repos", "Stress"],
    "requirementRefs": [],
    "effectRefs": [],
    "catalog": {
      "kind": "talent-general",
      "sourceSection": "### 31.3 Talents généraux de niveau 1",
      "family": "Vitalité et récupération",
      "ancestry": "",
      "skill": "",
      "activation": "Passif",
      "prerequisites": "",
      "choice": "",
      "frequency": "",
      "trigger": "",
      "duration": "",
      "metadata": {
        "Famille": "Vitalité et récupération",
        "Traits": "Général, Repos, Stress",
        "Type": "Passif"
      }
    },
    "level": 1
  }
}
