{
  "relisId": "ALM-008",
  "name": "Ration hyperprotéinée",
  "type": "consumable",
  "tags": ["materiel", "alimentation"],
  "system": {
    "description": "<p>1 — 1 paquet — 1 — 0,15 L — 18 mois — destinée à effort lourd ; exige 0,5 L d’eau supplémentaire — 033</p>",
    "traits": [],
    "requirementRefs": [],
    "effectRefs": [],
    "catalog": {
      "kind": "alimentation",
      "sourceSection": "55.3.3 Rations et aliments conservés — ALM-001 à ALM-012",
      "canonicalRow": [
        "ALM-008",
        "Ration hyperprotéinée",
        "1",
        "1 paquet",
        "1",
        "0,15 L",
        "18 mois",
        "destinée à effort lourd ; exige 0,5 L d’eau supplémentaire",
        "033"
      ]
    },
    "physical": {
      "quantity": 1,
      "unit": "count",
      "massEach": null,
      "volumeEach": null,
      "bulkEach": null,
      "containerRef": {
        "relisId": "",
        "uuid": "",
        "documentName": "Item",
        "type": "container",
        "state": "resolved",
        "labelSnapshot": "",
        "missingPolicy": "diagnose"
      },
      "locationKey": "",
      "custodianRef": {
        "relisId": "",
        "uuid": "",
        "documentName": "Item",
        "type": "Actor",
        "state": "resolved",
        "labelSnapshot": "",
        "missingPolicy": "diagnose"
      },
      "ownershipState": "owned",
      "accessibility": "stored",
      "maintenanceRefs": [],
      "equipState": "stored",
      "bodyId": "",
      "hands": 0,
      "hostRef": {
        "relisId": "",
        "uuid": "",
        "documentName": "Item",
        "type": "Item",
        "state": "resolved",
        "labelSnapshot": "",
        "missingPolicy": "diagnose"
      },
      "equipmentProfile": {},
      "condition": "intact",
      "wear": 0,
      "charges": {
        "current": null,
        "maximum": null,
        "unit": "charge"
      },
      "expiresAt": {
        "worldTime": null,
        "calendarId": "",
        "displayOverride": "",
        "precision": "exact"
      },
      "identified": true
    },
    "level": 1,
    "consumableProfile": {
      "kind": "utility",
      "effectSummary": "destinée à effort lourd ; exige 0,5 L d’eau supplémentaire"
    },
    "energyProfile": {
      "kind": "",
      "current": null,
      "maximum": null,
      "rechargeable": false
    }
  }
}
