{
  "relisId": "ROQ-70",
  "name": "Roquette 70 mm",
  "type": "ammunition",
  "tags": ["materiel", "munition", "standard", "roq"],
  "system": {
    "description": "<dl><div><dt>Code</dt><dd>ROQ-70</dd></div>\n<div><dt>Projectile</dt><dd>Roquette 70 mm</dd></div>\n<div><dt>Interface</dt><dd>tube compatible</dd></div>\n<div><dt>Prix standard</dt><dd>250</dd></div>\n<div><dt>Conditionnement</dt><dd>unité</dd></div></dl>",
    "traits": [],
    "requirementRefs": [],
    "effectRefs": [],
    "catalog": {
      "kind": "ammunition-standard",
      "sourceSection": "41.175 Projectiles spécialisés",
      "columns": {
        "Code": "ROQ-70",
        "Projectile": "Roquette 70 mm",
        "Interface": "tube compatible",
        "Prix standard": "250",
        "Conditionnement": "unité"
      }
    },
    "physical": {
      "quantity": 1,
      "unit": "count",
      "massEach": null,
      "volumeEach": null,
      "bulkEach": null,
      "containerRef": {
        "relisId": "",
        "uuid": "",
        "documentName": "Item",
        "type": "container",
        "state": "resolved",
        "labelSnapshot": "",
        "missingPolicy": "diagnose"
      },
      "locationKey": "",
      "custodianRef": {
        "relisId": "",
        "uuid": "",
        "documentName": "Item",
        "type": "Actor",
        "state": "resolved",
        "labelSnapshot": "",
        "missingPolicy": "diagnose"
      },
      "ownershipState": "owned",
      "accessibility": "stored",
      "maintenanceRefs": [],
      "equipState": "stored",
      "bodyId": "",
      "hands": 0,
      "hostRef": {
        "relisId": "",
        "uuid": "",
        "documentName": "Item",
        "type": "Item",
        "state": "resolved",
        "labelSnapshot": "",
        "missingPolicy": "diagnose"
      },
      "equipmentProfile": {},
      "condition": "intact",
      "wear": 0,
      "charges": {
        "current": null,
        "maximum": null,
        "unit": "charge"
      },
      "expiresAt": {
        "worldTime": null,
        "calendarId": "",
        "displayOverride": "",
        "precision": "exact"
      },
      "identified": true
    },
    "referencePrice": {
      "amount": 250,
      "currencyRef": {
        "relisId": "MAT-RES-CREDIT",
        "uuid": "",
        "documentName": "Item",
        "type": "resource",
        "state": "resolved",
        "labelSnapshot": "Crédit",
        "missingPolicy": "diagnose"
      },
      "unit": "count",
      "quantityBasis": 1,
      "sourceRefs": []
    },
    "ammunitionProfile": {
      "familyId": "grenade",
      "variantId": "standard",
      "chamberingId": "ROQ-70",
      "chamberId": "ROQ-70",
      "pressureClassId": "specializedProjectile",
      "pressureClass": "specializedProjectile",
      "feedInterfaceIds": ["singleProjectile"],
      "feedInterfaces": ["singleProjectile"],
      "damageTypes": [],
      "damageSources": ["ballistic"],
      "specialTraits": [],
      "recoverable": false,
      "loadOrder": 0
    }
  }
}
