{
  "relisId": "PRO-TAL-CMP-ACROBATIES-002",
  "name": "Réception contrôlée",
  "type": "talent",
  "tags": ["progression", "talent", "competence"],
  "system": {
    "description": "<p>Si le personnage peut orienter son corps et dispose d&#39;une surface sur laquelle rouler, glisser ou répartir l&#39;impact, il effectue un test d&#39;Acrobaties contre le DD de la chute ou du terrain.</p>\n<p>• Réussite critique : la distance effective de chute est réduite de 12 mètres ; le personnage atterrit debout.</p>\n<p>• Réussite : la distance effective de chute est réduite de 6 mètres ; le personnage choisit d&#39;atterrir debout ou de se retrouver au sol sans conséquence supplémentaire.</p>\n<p>• Échec : la chute est résolue normalement.</p>\n<p>• Échec critique : la chute est résolue normalement et le personnage tombe au sol si sa morphologie le permet.</p>\n<p>Le talent ne fournit aucune prise dans le vide et ne fonctionne pas si le personnage est paralysé, inconscient ou totalement incapable de se mouvoir.</p>",
    "traits": ["Acrobaties", "Compétence", "Mouvement", "Réaction"],
    "requirementRefs": [],
    "effectRefs": [],
    "catalog": {
      "kind": "talent-competence",
      "sourceSection": "Acrobaties — #### Niveau 1 — Qualifié",
      "family": "",
      "ancestry": "",
      "skill": "Acrobaties",
      "activation": "Réaction",
      "prerequisites": "Acrobaties Qualifié",
      "choice": "",
      "frequency": "une fois par round",
      "trigger": "le personnage chute ou tombe vers un niveau inférieur",
      "duration": "",
      "metadata": {
        "Compétence": "Acrobaties",
        "Niveau": "1",
        "Traits": "Acrobaties, Compétence, Mouvement, Réaction",
        "Type": "Réaction",
        "Fréquence": "une fois par round",
        "Déclencheur": "le personnage chute ou tombe vers un niveau inférieur",
        "Prérequis": "Acrobaties Qualifié",
        "Réussite critique": "la distance effective de chute est réduite de 12 mètres ; le personnage atterrit debout.",
        "Réussite": "la distance effective de chute est réduite de 6 mètres ; le personnage choisit d'atterrir debout ou de se retrouver au sol sans conséquence supplémentaire.",
        "Échec": "la chute est résolue normalement.",
        "Échec critique": "la chute est résolue normalement et le personnage tombe au sol si sa morphologie le permet."
      }
    },
    "level": 1
  }
}
