{
  "relisId": "CRE-ANC-005-BEASTKIN-FELIN",
  "name": "Beastkin Félin",
  "type": "ancestry",
  "tags": ["creation", "ascendance"],
  "system": {
    "description": "<p>Les Beastkins sont des humanoïdes à traits animaux marqués. Leur lignée peut exprimer des sens améliorés, des armes naturelles ou des capacités liées au mouvement et à l’environnement.</p>\n<p><strong>Identité de la lignée Beastkin Félin :</strong> Prédateur complet : puissant, rapide, endurant, mais plus instinctif ou impulsif.</p>\n<h3>Héritage Beastkin</h3>\n<ul><li>traits physiques forts ;</li><li>sens améliorés ;</li><li>griffes, crocs, queue, odorat, vision nocturne selon lignée ;</li><li>capacités liées au mouvement ou à l’environnement.</li></ul>\n<h3>Profil d’Ascendance</h3>\n<p><strong>Bonus d’Attribut :</strong> +1 Force, +1 Dextérité, +1 Vigueur</p>\n<p><strong>Malus d’Attribut :</strong> -1 Volonté</p>\n<p><strong>Logique :</strong> Prédateur complet : puissant, rapide, endurant, mais plus instinctif ou impulsif.</p>\n<h3>Vitalité et énergies naturelles</h3>\n<p><strong>PV :</strong> 12 PV d’Ascendance</p>\n<p><strong>Réserves naturelles :</strong> Profil naturel : Prana 6, Mana 2, Flux 0</p>",
    "traits": [],
    "requirementRefs": [],
    "effectRefs": [],
    "catalog": {
      "kind": "ancestry",
      "sourceSection": "5",
      "attributeBonuses": "+1 Force, +1 Dextérité, +1 Vigueur",
      "attributePenalty": "-1 Volonté",
      "rationale": "Prédateur complet : puissant, rapide, endurant, mais plus instinctif ou impulsif.",
      "selectable": true,
      "hitPointProfile": {
        "mode": "fixed",
        "value": 12
      },
      "energyProfiles": [
        {
          "id": "natural",
          "label": "Profil naturel",
          "prana": 6,
          "mana": 2,
          "flux": 0
        }
      ],
      "energySelectionRequired": false,
      "energyComponentsRemainSeparate": true
    }
  },
  "folder": ""
}
