{
  "relisId": "PRO-TAL-ANC-BEASTKIN-LOUP-536",
  "name": "Territoire lu",
  "type": "talent",
  "tags": ["progression", "talent", "ascendance"],
  "system": {
    "description": "<p><strong>Territoire lu</strong>.</p><p>Le personnage étudie une zone de 12 mètres de rayon. Lui-même et les membres du cercle auxquels il transmet sa lecture gagnent +2 circonstanciel à l&#39;Initiative et aux tests de Perception contre intrusion, embuscade ou danger naturel dans cette zone.</p>\n<p>Une seule zone peut être préparée. Le talent ne crée aucun couvert, piège, propriété ou moyen de détecter l&#39;imperceptible.</p>",
    "traits": ["Beastkin", "Loup", "Exploration", "Vigilance"],
    "requirementRefs": [
      {
        "relisId": "PRO-TAL-ANC-BEASTKIN-LOUP-527",
        "uuid": "",
        "documentName": "Item",
        "type": "talent",
        "state": "resolved",
        "labelSnapshot": "Sentier sauvage",
        "missingPolicy": "diagnose"
      }
    ],
    "effectRefs": [],
    "catalog": {
      "kind": "talent-ascendance",
      "sourceSection": "### 5.153 Talents Beastkins Loups de niveau 5",
      "family": "Territoire et autonomie en milieu hostile",
      "ancestry": "Beastkin Loup",
      "skill": "",
      "activation": "Activité de 10 minutes",
      "prerequisites": "Sentier sauvage",
      "choice": "",
      "frequency": "",
      "trigger": "",
      "duration": "",
      "metadata": {
        "Famille": "Territoire et autonomie en milieu hostile",
        "Traits": "Beastkin, Loup, Exploration, Vigilance",
        "Type": "Activité de 10 minutes",
        "Prérequis": "Sentier sauvage"
      }
    },
    "level": 5
  },
  "folder": "Beastkin Loup"
}
