{
  "relisId": "PRO-TAL-ANC-5-20-CATALOGUE-HUMAIN-044",
  "name": "Humanité unifiée",
  "type": "talent",
  "tags": ["progression", "talent", "ascendance"],
  "system": {
    "description": "<p>Le personnage constitue un réseau de coordination comprenant jusqu&#39;à 3 + sa Présence participants, avec un minimum de 3, lui-même compris.</p>\n<p>Le réseau dure jusqu&#39;au prochain repos long, jusqu&#39;à sa dissolution volontaire ou jusqu&#39;à ce que les membres ne disposent plus d&#39;aucun moyen raisonnable de communiquer.</p>\n<p>Ses membres obtiennent les avantages suivants :</p>\n<p>• ils peuvent utiliser Aider à distance lorsque des communications fiables leur permettent réellement de conseiller, calculer, observer ou coordonner l&#39;action ;</p>\n<p>• une fois par round pour l&#39;ensemble du réseau, un membre peut dépenser sa Réaction afin d&#39;Aider un autre membre sur un test immédiat, sans avoir préparé l&#39;Aide avec une action préalable ;</p>\n<p>• le membre qui aide doit être au moins Qualifié dans une compétence pertinente et expliquer sa contribution ;</p>\n<p>• sur une Aide réussie, un troisième membre participant au même objectif gagne +1 circonstanciel à son prochain test directement lié ; ce bonus devient +2 sur une réussite critique de l&#39;Aide.</p>\n<p>Une même action ne peut recevoir qu&#39;un seul bonus d&#39;Aide. Les bonus secondaires du réseau ne se cumulent pas avec Coordination instinctive ou Chaîne de confiance pour le même test : seul le meilleur s&#39;applique.</p>\n<p>Les coûts et la procédure d&#39;Aider sont raccordés à la procédure d&#39;Aide de la section 38.10.</p>",
    "traits": ["Humain", "Coopération", "Mental", "Concentration"],
    "requirementRefs": [
      {
        "relisId": "PRO-TAL-ANC-5-20-CATALOGUE-HUMAIN-030",
        "uuid": "",
        "documentName": "Item",
        "type": "talent",
        "state": "resolved",
        "labelSnapshot": "Chaîne de confiance",
        "missingPolicy": "diagnose"
      },
      {
        "relisId": "PRO-TAL-ANC-5-20-CATALOGUE-HUMAIN-037",
        "uuid": "",
        "documentName": "Item",
        "type": "talent",
        "state": "resolved",
        "labelSnapshot": "Unis face à l'inconnu",
        "missingPolicy": "diagnose"
      }
    ],
    "effectRefs": [],
    "catalog": {
      "kind": "talent-ascendance",
      "sourceSection": "### 5.26 Talents Humains de niveau 21",
      "family": "Dépassement humain",
      "ancestry": "### 5.20 Catalogue Humain",
      "skill": "",
      "activation": "préparation de 10 minutes",
      "prerequisites": "Unis face à l'inconnu ou Chaîne de confiance",
      "choice": "",
      "frequency": "",
      "trigger": "",
      "duration": "",
      "metadata": {
        "Famille": "Dépassement humain",
        "Traits": "Humain, Coopération, Mental, Concentration",
        "Type": "préparation de 10 minutes",
        "Prérequis": "Unis face à l'inconnu ou Chaîne de confiance"
      }
    },
    "level": 21
  }
}
