{
  "relisId": "CRE-ORI-MIL-010",
  "name": "Nomade / itinérant",
  "type": "origin",
  "tags": ["creation", "origine", "milieu-social"],
  "system": {
    "description": "<p><strong>Nomade / itinérant</strong>.</p><p>Le personnage a souvent changé de lieu, de station, de refuge, de contrat ou de communauté. — Polyglotte, Instinct de survie, Chance insolente — Identité falsifiée, Dette, Réputation noire</p>",
    "traits": [],
    "requirementRefs": [],
    "effectRefs": [],
    "catalog": {
      "kind": "origin-milieu-social",
      "sourceSection": "7",
      "fields": {
        "Description": "Le personnage a souvent changé de lieu, de station, de refuge, de contrat ou de communauté.",
        "Atouts suggérés": "Polyglotte, Instinct de survie, Chance insolente",
        "Handicaps suggérés": "Identité falsifiée, Dette, Réputation noire"
      }
    }
  },
  "folder": "milieu-social"
}
