{
  "relisId": "PRO-TAL-ANC-5-184-CATALOGUE-BEASTKIN-SOURIS-631",
  "name": "Lire l'interstice",
  "type": "talent",
  "tags": ["progression", "talent", "ascendance"],
  "system": {
    "description": "<p>Le personnage gagne +2 circonstanciel aux tests de Perception, d&#39;Investigation ou d&#39;Ingénierie pour estimer si un conduit, une ouverture, un faux plancher, un meuble ou une infrastructure peut supporter son passage et son équipement.</p>\n<p>Sur une réussite, il identifie aussi le principal obstacle visible : largeur, angle, charge, chaleur, ventilation ou sortie bloquée. Le talent ne révèle aucun danger caché sans indice.</p>",
    "traits": ["Beastkin", "Souris", "Exploration", "Perception"],
    "requirementRefs": [],
    "effectRefs": [],
    "catalog": {
      "kind": "talent-ascendance",
      "sourceSection": "### 5.185 Talents Beastkins Souris de niveau 1",
      "family": "Petit gabarit et interstices",
      "ancestry": "### 5.184 Catalogue Beastkin Souris",
      "skill": "",
      "activation": "Passif",
      "prerequisites": "",
      "choice": "",
      "frequency": "",
      "trigger": "",
      "duration": "",
      "metadata": {
        "Famille": "Petit gabarit et interstices",
        "Traits": "Beastkin, Souris, Exploration, Perception",
        "Type": "Passif"
      }
    },
    "level": 1
  }
}
