{
  "relisId": "PRO-SPE-03-02-PISTOLERO",
  "name": "Tireur — Pistolero",
  "type": "specialization",
  "tags": ["progression", "specialisation", "tireur"],
  "system": {
    "description": "<p><strong>Tireur — Pistolero</strong>.</p><p>La branche <strong>Pistolero</strong> de la Voie <strong>Tireur</strong> développe armes de poing, réactions, mobilité..</p>\n<p><strong>Dotation principale :</strong> Paire de pistolets légers ou pistolet lourd avec holster tactique.</p>\n<p>Son catalogue comprend trente-deux Talents : deux choix à chacun des seize paliers de la progression principale et mythique.</p>",
    "traits": [],
    "requirementRefs": [
      {
        "relisId": "PRO-VOI-003-TIREUR",
        "uuid": "",
        "documentName": "Item",
        "type": "path",
        "state": "resolved",
        "labelSnapshot": "Tireur",
        "missingPolicy": "diagnose"
      }
    ],
    "effectRefs": [],
    "catalog": {
      "kind": "specialization",
      "sourceSection": "9",
      "pathName": "Tireur",
      "branchName": "Pistolero",
      "orientation": "armes de poing, réactions, mobilité.",
      "primaryLoadout": "Paire de pistolets légers ou pistolet lourd avec holster tactique.",
      "loadoutRefs": [
        {
          "relisId": "MAT-WPN-033-PISTOLET-LOURD",
          "uuid": "",
          "documentName": "Item",
          "type": "weapon",
          "state": "resolved",
          "labelSnapshot": "Pistolet lourd",
          "missingPolicy": "diagnose"
        }
      ]
    }
  },
  "folder": "Tireur"
}
