{
  "relisId": "UTL-002",
  "name": "Outils de mécanique de précision",
  "type": "equipment",
  "tags": ["materiel", "utilitaire"],
  "system": {
    "description": "<p>2 — 2 — 20 — armes, drones, articulations et petits moteurs — 021/030</p>",
    "traits": [],
    "requirementRefs": [],
    "effectRefs": [],
    "catalog": {
      "kind": "utilitaire",
      "sourceSection": "55.6.2 Trousses techniques et scientifiques — UTL-001 à UTL-016",
      "canonicalRow": [
        "UTL-002",
        "Outils de mécanique de précision",
        "2",
        "2",
        "20",
        "armes, drones, articulations et petits moteurs",
        "021/030"
      ]
    },
    "physical": {
      "quantity": 1,
      "unit": "count",
      "massEach": null,
      "volumeEach": null,
      "bulkEach": null,
      "containerRef": {
        "relisId": "",
        "uuid": "",
        "documentName": "Item",
        "type": "container",
        "state": "resolved",
        "labelSnapshot": "",
        "missingPolicy": "diagnose"
      },
      "locationKey": "",
      "custodianRef": {
        "relisId": "",
        "uuid": "",
        "documentName": "Item",
        "type": "Actor",
        "state": "resolved",
        "labelSnapshot": "",
        "missingPolicy": "diagnose"
      },
      "ownershipState": "owned",
      "accessibility": "stored",
      "maintenanceRefs": [],
      "equipState": "stored",
      "bodyId": "",
      "hands": 0,
      "hostRef": {
        "relisId": "",
        "uuid": "",
        "documentName": "Item",
        "type": "Item",
        "state": "resolved",
        "labelSnapshot": "",
        "missingPolicy": "diagnose"
      },
      "equipmentProfile": {},
      "condition": "intact",
      "wear": 0,
      "charges": {
        "current": null,
        "maximum": null,
        "unit": "charge"
      },
      "expiresAt": {
        "worldTime": null,
        "calendarId": "",
        "displayOverride": "",
        "precision": "exact"
      },
      "identified": true
    },
    "level": 2,
    "energyProfile": {
      "kind": "",
      "current": null,
      "maximum": null,
      "rechargeable": false
    },
    "supplyProfile": {}
  }
}
