{
  "relisId": "PRO-TAL-ANC-BEASTKIN-LOUP-520",
  "name": "Cercle choisi",
  "type": "talent",
  "tags": ["progression", "talent", "ascendance"],
  "system": {
    "description": "<p><strong>Cercle choisi</strong>.</p><p>Le personnage forme un cercle avec un maximum de quatre créatures volontaires, lui compris. Tant qu&#39;au moins un autre membre se trouve à 6 mètres, le Loup gagne +2 circonstanciel aux tests de Perception ou de Sang-froid contre une menace visant plusieurs membres du cercle.</p>\n<p>Le cercle dure jusqu&#39;au prochain repos long et peut être recomposé d&#39;un commun accord. Il ne crée ni chef, ni ordre obligatoire, ni localisation surnaturelle et ne donne aucun contrôle sur les membres.</p>",
    "traits": ["Beastkin", "Loup", "Coopération", "Social"],
    "requirementRefs": [],
    "effectRefs": [],
    "catalog": {
      "kind": "talent-ascendance",
      "sourceSection": "### 5.152 Talents Beastkins Loups de niveau 1",
      "family": "Meute choisie et rôles mouvants",
      "ancestry": "Beastkin Loup",
      "skill": "",
      "activation": "Activité de 10 minutes",
      "prerequisites": "",
      "choice": "",
      "frequency": "",
      "trigger": "",
      "duration": "",
      "metadata": {
        "Famille": "Meute choisie et rôles mouvants",
        "Traits": "Beastkin, Loup, Coopération, Social",
        "Type": "Activité de 10 minutes"
      }
    },
    "level": 1
  },
  "folder": "Beastkin Loup"
}
